{
  "$schema": "https://example.invalid/trimui-brick-package-v1.schema.json",
  "capabilities": {
    "audio": [],
    "display": [
      "read"
    ],
    "input": [],
    "network": [],
    "save": []
  },
  "entrypoints": [],
  "files": [
    {
      "class": "immutable",
      "length": 2766,
      "path": "immutable/theme.json",
      "sha256": "d7970d60419f39fb27b75b6981237f77ccaa2d72af72e2cd5895389568708a19"
    }
  ],
  "format": "brickpro-package",
  "id": "minimal",
  "runtime": {
    "dependencies": [],
    "path": "runtime"
  },
  "schemaVersion": 1,
  "targetSku": "TG4040",
  "type": "theme",
  "uninstall": {
    "preserve": [
      "/roms",
      "/data/saves",
      "/data/states"
    ],
    "remove": [
      "immutable",
      "runtime",
      "cache",
      "staging"
    ]
  },
  "version": "1.0.0"
}
